{
  "version": "0.1.0",
  "updatedAt": "2026-09-16T00:00:00Z",
  "locale": "en-US",
  "blocks": [
    {
      "id": "A",
      "name": "Spectra",
      "question": "Who you are",
      "order": 0,
      "standalone": true
    }
  ],
  "responseScales": [
    {
      "id": "agree5",
      "type": "likert",
      "allowNotApplicable": false,
      "options": [
        {
          "value": 1,
          "label": "Strongly disagree"
        },
        {
          "value": 2,
          "label": "Disagree"
        },
        {
          "value": 3,
          "label": "Neutral"
        },
        {
          "value": 4,
          "label": "Agree"
        },
        {
          "value": 5,
          "label": "Strongly agree"
        }
      ]
    }
  ],
  "scales": [
    {
      "id": "a2_threat",
      "block": "A",
      "name": "Threat reactivity",
      "poles": {
        "low": "Unflappable",
        "high": "Highly reactive"
      },
      "definition": "How readily and how durably negative emotion is triggered by threat, loss or criticism.",
      "facets": [
        {
          "id": "a2_threat.trigger",
          "name": "Trigger threshold",
          "definition": "How little it takes to set off negative emotion."
        },
        {
          "id": "a2_threat.persistence",
          "name": "Persistence",
          "definition": "How long negative emotion lasts once triggered."
        },
        {
          "id": "a2_threat.anticipation",
          "name": "Anticipation",
          "definition": "How much is spent on threats that have not happened."
        }
      ],
      "scoring": {
        "method": "mean",
        "minItemsAnswered": 5
      },
      "bodyLinks": [
        {
          "system": "serotonin 5-HT2A",
          "grade": "moderate",
          "mechanism": "Cortical 5-HT2A binding tracks the inward facets of neuroticism (r = .37, replicated with a second tracer), and SSRIs lower neuroticism beyond their effect on depression.",
          "verification": "No individual-level test. Group-level PET and drug-response evidence only.",
          "citations": [
            "hogsted2023",
            "tang2009"
          ]
        }
      ],
      "report": {
        "showPercentile": true,
        "stigmaRisk": "medium",
        "stateSensitivity": "high",
        "copy": {
          "costId": "copy_a2_cost",
          "upsideId": "copy_a2_upside"
        }
      }
    }
  ],
  "items": [
    {
      "id": "a2_threat_t01",
      "status": "draft",
      "addedInVersion": "0.1.0",
      "block": "A",
      "scaleId": "a2_threat",
      "facetId": "a2_threat.trigger",
      "text": "Small criticisms land harder on me than they should.",
      "informantText": "Small criticisms land harder on them than they should.",
      "responseScaleId": "agree5",
      "keyed": "+",
      "timeframe": "general",
      "review": {
        "culturalLoad": "low",
        "desirabilityRisk": "low",
        "readabilityGrade": 6.2,
        "notes": "Re-tagged mild → moderate: the item asks the respondent to concede disproportion, which is a stronger admission than a mild-band statement."
      },
      "provenance": {
        "origin": "original"
      },
      "tags": [
        "severity:moderate"
      ]
    },
    {
      "id": "a2_threat_t02",
      "status": "draft",
      "addedInVersion": "0.1.0",
      "block": "A",
      "scaleId": "a2_threat",
      "facetId": "a2_threat.trigger",
      "text": "It takes a lot to rattle me.",
      "informantText": "It takes a lot to rattle them.",
      "responseScaleId": "agree5",
      "keyed": "-",
      "timeframe": "general",
      "review": {
        "culturalLoad": "medium",
        "desirabilityRisk": "medium",
        "readabilityGrade": 3.4,
        "notes": "Stoicism is differently valued by culture and gender; the same inner experience may be reported differently. DIF-test by gender."
      },
      "provenance": {
        "origin": "original"
      },
      "tags": [
        "severity:mild"
      ]
    },
    {
      "id": "a2_threat_t03",
      "status": "draft",
      "addedInVersion": "0.1.0",
      "block": "A",
      "scaleId": "a2_threat",
      "facetId": "a2_threat.trigger",
      "text": "I pick up on a change in someone's tone straight away.",
      "informantText": "They pick up on a change in someone's tone straight away.",
      "responseScaleId": "agree5",
      "keyed": "+",
      "timeframe": "general",
      "review": {
        "culturalLoad": "low",
        "desirabilityRisk": "medium",
        "readabilityGrade": 5.0,
        "notes": "Boundary with A7 detail/change sensitivity, and with sensory processing sensitivity generally. Detection is not the same as distress; cut if it loads on A7."
      },
      "provenance": {
        "origin": "original"
      },
      "tags": [
        "severity:mild",
        "boundary:a7"
      ]
    },
    {
      "id": "a2_threat_t04",
      "status": "draft",
      "addedInVersion": "0.1.0",
      "block": "A",
      "scaleId": "a2_threat",
      "facetId": "a2_threat.trigger",
      "text": "People describe me as hard to upset.",
      "informantText": "People describe them as hard to upset.",
      "responseScaleId": "agree5",
      "keyed": "-",
      "timeframe": "general",
      "review": {
        "culturalLoad": "low",
        "desirabilityRisk": "low",
        "readabilityGrade": 4.1
      },
      "provenance": {
        "origin": "original"
      },
      "tags": [
        "severity:moderate",
        "other-observed"
      ]
    },
    {
      "id": "a2_threat_t05",
      "status": "draft",
      "addedInVersion": "0.1.0",
      "block": "A",
      "scaleId": "a2_threat",
      "facetId": "a2_threat.trigger",
      "text": "A short, neutral message from someone can put me on edge.",
      "informantText": "A short, neutral message from someone can put them on edge.",
      "responseScaleId": "agree5",
      "keyed": "+",
      "timeframe": "general",
      "review": {
        "culturalLoad": "low",
        "desirabilityRisk": "low",
        "readabilityGrade": 5.7
      },
      "provenance": {
        "origin": "original"
      },
      "tags": [
        "severity:moderate"
      ]
    },
    {
      "id": "a2_threat_t06",
      "status": "draft",
      "addedInVersion": "0.1.0",
      "block": "A",
      "scaleId": "a2_threat",
      "facetId": "a2_threat.trigger",
      "text": "I can be corrected in front of other people without it getting to me.",
      "informantText": "They can be corrected in front of other people without it getting to them.",
      "responseScaleId": "agree5",
      "keyed": "-",
      "timeframe": "general",
      "review": {
        "culturalLoad": "medium",
        "desirabilityRisk": "medium",
        "readabilityGrade": 6.0,
        "notes": "Face and public correction carry different weight across cultures; flagged for DIF by locale."
      },
      "provenance": {
        "origin": "original"
      },
      "tags": [
        "severity:moderate"
      ]
    },
    {
      "id": "a2_threat_t07",
      "status": "draft",
      "addedInVersion": "0.1.0",
      "block": "A",
      "scaleId": "a2_threat",
      "facetId": "a2_threat.trigger",
      "text": "The smallest sign of disapproval can change how my whole day feels.",
      "informantText": "The smallest sign of disapproval can change how their whole day feels.",
      "responseScaleId": "agree5",
      "keyed": "+",
      "timeframe": "general",
      "review": {
        "culturalLoad": "low",
        "desirabilityRisk": "low",
        "readabilityGrade": 6.4
      },
      "provenance": {
        "origin": "original"
      },
      "tags": [
        "severity:extreme"
      ]
    },
    {
      "id": "a2_threat_t08",
      "status": "draft",
      "addedInVersion": "0.1.0",
      "block": "A",
      "scaleId": "a2_threat",
      "facetId": "a2_threat.trigger",
      "text": "Things that visibly upset other people genuinely don't sting me.",
      "informantText": "Things that visibly upset other people genuinely don't sting them.",
      "responseScaleId": "agree5",
      "keyed": "-",
      "timeframe": "general",
      "review": {
        "culturalLoad": "low",
        "desirabilityRisk": "medium",
        "readabilityGrade": 6.8,
        "notes": "Extreme low-pole item. Risks capturing emotional flatness or callousness rather than low reactivity; check cross-loading on A5 callousness and on the state block."
      },
      "provenance": {
        "origin": "original"
      },
      "tags": [
        "severity:extreme",
        "boundary:a5"
      ]
    },
    {
      "id": "a2_threat_p01",
      "status": "draft",
      "addedInVersion": "0.1.0",
      "block": "A",
      "scaleId": "a2_threat",
      "facetId": "a2_threat.persistence",
      "text": "Something that went wrong hours ago is still running in my head.",
      "informantText": "Something that went wrong hours ago is still running in their head.",
      "responseScaleId": "agree5",
      "keyed": "+",
      "timeframe": "general",
      "review": {
        "culturalLoad": "low",
        "desirabilityRisk": "low",
        "readabilityGrade": 5.4
      },
      "provenance": {
        "origin": "original"
      },
      "tags": [
        "severity:mild"
      ]
    },
    {
      "id": "a2_threat_p02",
      "status": "draft",
      "addedInVersion": "0.1.0",
      "block": "A",
      "scaleId": "a2_threat",
      "facetId": "a2_threat.persistence",
      "text": "Once a difficult conversation ends, I stop thinking about it.",
      "informantText": "Once a difficult conversation ends, they stop thinking about it.",
      "responseScaleId": "agree5",
      "keyed": "-",
      "timeframe": "general",
      "review": {
        "culturalLoad": "low",
        "desirabilityRisk": "low",
        "readabilityGrade": 5.0,